{"schemaVersion":1,"kind":"agent-first-evidence-cell","cellId":"cell_0a6c7171de37eaa1d0211b40359d9401","status":"passed","identity":{"buildIdentity":"sha256:02a0a7eff11966bb5a5ecb11e4bc0d7342b56a98aee7ab337b52ff2aca26398e","sourceRevision":"flask:launchdeck-flask-demo","packageDigest":"sha256:e449096166bbd4f5249b882b78a94be4e8ad87f6549767a1db6957b923cf3f8c","payloadDigest":"sha256:becb7b9877f5246607acfad0e9fc6e65099ef5292596208c908a373155b0e6f8"},"environment":{"os":{"platform":"windows","version":"10.0.26200","arch":"x64"},"node":{"version":"22.23.1"}},"host":{"id":"none","version":"deterministic-installed-agent-fixture","versionEvidenceDigest":"sha256:1ece50c4f032e40ece09836948562fa5b3dc6a840d263cbec85e1933963f0384","capabilityMatrixRevision":"deterministic-installed-agent-fixture"},"scope":{"kind":"project","identity":"project:sha256:89accd90991ea3bcf7108d861a2c15ce14b58c541b27a1cba5ab997f01b52dfe"},"component":"flask","scenario":{"id":"agent-first-flask-lifecycle","kind":"flask","revision":"sha256:966a174948db1936df15c58cce0a51220a294495c834057779a258f4c18f7edd"},"command":{"entrypoint":"launchdeck flask lifecycle","argv":["launchdeck","up","status --all","logs start","down"],"cwd":"<PROJECT>"},"result":{"exitCode":0,"outcome":"succeeded","effectCertainty":"complete","stdoutSha256":"sha256:d7fc5d5c1bfd45fad3bb51334f02e8d9e51119382e3a796507bac5d3c8e64878","stderrSha256":"sha256:ef2cbacb146715dada26eb19149de0a7f7e5d6cf8aa2574c9e3d4111c203eae5"},"candidate":{"kind":"scenario","uri":"flask:sha256:02a0a7eff11966bb5a5ecb11e4bc0d7342b56a98aee7ab337b52ff2aca26398e","sha256":"sha256:99a40dbe9a7042ba24e534c29b9672b79a377971af405d19bb21f3e67ca64f03","byteLength":948,"manifestDigest":"sha256:966a174948db1936df15c58cce0a51220a294495c834057779a258f4c18f7edd","immutable":true,"mutable":false},"readiness":{"claim":"ready","source":"observed","inferred":false,"checks":[{"name":"installerSucceeded","status":"passed","digest":"sha256:89f358c430f66c6d51f1d717d5747dbf171b5b47f97af6bded60743f9559da84"},{"name":"installerLeftProjectConfigAbsent","status":"passed","digest":"sha256:df95e1e32d674a922ead2e4d097f68d546a7703fec8ca26ff6275426d33e3809"},{"name":"agentAuthoredConfig","status":"passed","digest":"sha256:282c65e1636e57015013ea6c1b18d38b30bbcad1376d3f914043f7d6cdaef58a"},{"name":"agentMcpAndBuildProof","status":"passed","digest":"sha256:8c2a5549a6fcf2b745ec6a27b31a5bf5c12221e885e7d9bc36d2e9373a2893e2"},{"name":"deterministicAgentFixtureAuthored","status":"passed","digest":"sha256:6b3d2dd6de8f0cbf5cf1ceae57ab3d29bf10bd776bd293bfff36532ecf8b6d43"},{"name":"upSucceeded","status":"passed","digest":"sha256:0e3ee1b180fc310d19a8d5e3b2b4c3c769c740ae6c4dd3b4c9bb0ea438ba8c22"},{"name":"statusSucceeded","status":"passed","digest":"sha256:26ad5a6b47622ed1ef2ac66f4185386e177b481881951296440b001465132b0f"},{"name":"logsSucceeded","status":"passed","digest":"sha256:7ab47531f440ce00b8db8d60a6cdab94a76a344aec90dc03827b61232884a9de"},{"name":"startLogsObserved","status":"passed","digest":"sha256:10236d10932a35062b5b6c77d4091e5874bffd392a986e9040dc141e2ad19829"},{"name":"downSucceeded","status":"passed","digest":"sha256:918f68e008b489bfd9d37dd6781aacaf42e8d507b44f212df4a06917960e533e"},{"name":"statusAllUsed","status":"passed","digest":"sha256:a0ab2fdc097b395577d42b947adbf98a212683224bd04eeb74f4a23e9127d731"},{"name":"webpageReached","status":"passed","digest":"sha256:d157549679e6d639511a37cd805eff2dbd8f639298a4b5f8963a7bf01f919c5c"},{"name":"isolatedNoLiveUserState","status":"passed","digest":"sha256:0bbc04ab836e5c801ef14deec1143dada319d55f9aa223dba02fa9b027c5027f"},{"name":"producerBodyProofPresent","status":"passed","digest":"sha256:a5dbaf93bf93b85f9738ba59234229b9e9a6560dfd060bc7b1d2aeef03d5fc93"},{"name":"producerProvenanceComplete","status":"passed","digest":"sha256:67259fe459669a1709cc168bb019899553f31abb75ba6ca08fee1d5cc823cdb6"},{"name":"producerProvenanceMatchesBody","status":"passed","digest":"sha256:445a88856a41b501519929864e680ea9a1fc189cb3a516922789db3fe643416b"}]},"evidence":{"rawRefs":[{"path":"producer/flask-evidence.json","sha256":"sha256:f6089781a7adb25a9cb3ee4882c62f75fe05952eb51feb48091b4ee40753c294","byteLength":29200}]},"dependencies":[],"redaction":{"secretsRedacted":true,"livePathsRedacted":true,"placeholders":["<PROJECT>","<LAUNCHDECK_HOME>"]}}
